{
  "$schema": "https://json-schema.org/draft/2020-12/schema",
  "$id": "https://github.com/Aitbase/aitbase-vision-plugin-sdk/schema/plugin.schema.json",
  "title": "AITBASE VISION plugin manifest (plugin.json), draft",
  "description": "aitbase-plugin check enforces these rules and more (source id match, file names, screens). Keep both in sync.",
  "type": "object",
  "additionalProperties": false,
  "required": ["id", "name", "version", "api_version", "entry"],
  "properties": {
    "id": {
      "description": "Stable plugin id: two or more dot-separated lowercase parts. aitbase.* is reserved for official plugins. Must match AITBASE_PLUGIN_ID(...) in the source.",
      "type": "string",
      "maxLength": 64,
      "pattern": "^[a-z][a-z0-9_-]*(\\.[a-z][a-z0-9_-]*)+$"
    },
    "name": {
      "description": "Display name. The device's assistant opens the plugin by this name, so keep it short and easy to say.",
      "type": "string",
      "minLength": 1,
      "maxLength": 40
    },
    "version": {
      "description": "Semantic version MAJOR.MINOR.PATCH[-prerelease].",
      "type": "string",
      "pattern": "^(0|[1-9][0-9]*)\\.(0|[1-9][0-9]*)\\.(0|[1-9][0-9]*)(-[0-9A-Za-z.-]+)?$"
    },
    "api_version": {
      "description": "Plugin API version the plugin is written against.",
      "const": 1
    },
    "description": {
      "type": "string",
      "maxLength": 200
    },
    "entry": {
      "description": "Build target name of the plugin program.",
      "type": "string",
      "pattern": "^[a-z][a-z0-9_]*$"
    },
    "ui": {
      "type": "object",
      "additionalProperties": false,
      "properties": {
        "screens": {
          "description": "Screens in ui/screens/<name>.xml, opened with aitbase_ui_open(p, \"<name>\", ...).",
          "type": "array",
          "uniqueItems": true,
          "items": {"type": "string", "maxLength": 32, "pattern": "^[a-z][a-z0-9_]*$"}
        }
      }
    },
    "idle_face": {
      "description": "One of ui.screens, offered as the device's home screen face (since SDK 0.10). The owner chooses it on the Device Console; the device shows it display only (no buttons or actions, at most 24 widgets and 8 KiB compiled); firmware before 2026-10-22 also draws its badge over it. Its labels bind to face.1 to face.16, set with aitbase_face_set.",
      "type": "string",
      "maxLength": 32,
      "pattern": "^[a-z][a-z0-9_]*$"
    },
    "sounds": {
      "description": "Sounds in sounds/<name>.wav (16 kHz, mono, 16-bit PCM, at most 10 s), played with aitbase_audio_play(p, \"<name>\", ...), only while the plugin's screen is visible.",
      "type": "array",
      "uniqueItems": true,
      "items": {"type": "string", "maxLength": 32, "pattern": "^[a-z][a-z0-9_]*$"}
    },
    "triggers": {
      "description": "Starts the plugin without the user opening it. One kind: a schedule, every every_min minutes (15 to 1440) while the device is idle. aitbase_trigger() returns \"schedule\" for such a run.",
      "type": "array",
      "maxItems": 4,
      "items": {
        "type": "object",
        "required": ["event", "every_min"],
        "additionalProperties": false,
        "properties": {
          "event": {"const": "schedule"},
          "every_min": {"type": "integer", "minimum": 15, "maximum": 1440}
        }
      }
    },
    "assistant_tools": {
      "description": "Tools the device's voice assistant may call (since SDK 0.10, D31): the plugin gets AITBASE_EVENT_TOOL_CALL and answers with aitbase_tool_reply within 5 s. The device starts a plugin that isn't running, without a screen. Every declared argument is required. An invalid block offers no tools; the plugin still runs.",
      "type": "array",
      "maxItems": 4,
      "items": {
        "type": "object",
        "required": ["name", "description"],
        "additionalProperties": false,
        "properties": {
          "name": {"type": "string", "maxLength": 24, "pattern": "^[a-z][a-z0-9_]*$"},
          "description": {"description": "One line the assistant reads to choose the tool.", "type": "string", "minLength": 1, "maxLength": 120},
          "args": {
            "type": "object",
            "maxProperties": 4,
            "propertyNames": {"maxLength": 24, "pattern": "^[a-z][a-z0-9_]*$"},
            "additionalProperties": {
              "oneOf": [
                {
                  "type": "object", "additionalProperties": false, "required": ["type"],
                  "properties": {"type": {"const": "string"}, "max": {"type": "integer", "minimum": 1, "maximum": 120}}
                },
                {
                  "type": "object", "additionalProperties": false, "required": ["type", "min", "max"],
                  "properties": {"type": {"const": "int"}, "min": {"type": "integer"}, "max": {"type": "integer"}}
                },
                {
                  "type": "object", "additionalProperties": false, "required": ["type", "values"],
                  "properties": {
                    "type": {"const": "enum"},
                    "values": {"type": "array", "minItems": 1, "maxItems": 8, "uniqueItems": true, "items": {"type": "string", "minLength": 1, "maxLength": 32}}
                  }
                }
              ]
            }
          }
        }
      }
    },
    "settings": {
      "description": "Values the owner fills in on the Device Console (since SDK 0.12, device decision D38), such as a server address and a token. They are saved in the plugin's storage on the SD card: read them with aitbase_storage_get(p, \"settings.<key>\"). A secret is never shown again on the console. A running plugin gets AITBASE_EVENT_DEVICE with op \"plugin.settings_changed\" when the owner saves. An invalid block offers no settings; the plugin still runs.",
      "type": "array",
      "maxItems": 8,
      "items": {
        "type": "object",
        "required": ["key", "label", "type"],
        "additionalProperties": false,
        "properties": {
          "key": {"type": "string", "maxLength": 32, "pattern": "^[a-z][a-z0-9_]*$"},
          "label": {"type": "string", "minLength": 1, "maxLength": 48},
          "type": {"enum": ["text", "url", "secret"]},
          "placeholder": {"type": "string", "maxLength": 48}
        }
      }
    },
    "requested_capabilities": {
      "description": "Ignored since SDK 0.11 (device decision D32): every plugin may use every capability. Devices before 2026-10-20 still need it. check warns CAPABILITIES_IGNORED.",
      "type": "array",
      "uniqueItems": true,
      "items": {"enum": ["ui", "storage", "http", "audio.output", "schedule", "idle.face", "audio.stream", "assistant.tools"]}
    }
  }
}
